{
  "schema_version": "1.0",
  "manifest_key": "CURVE_M0_TELEMETRY",
  "manifest_version": 1,
  "default_mode": "DISABLED",
  "allowed_modes": ["DISABLED", "IN_MEMORY_TEST", "OTLP"],
  "configuration": {
    "mode_env": "CURVE_TELEMETRY_MODE",
    "endpoint_env": "CURVE_OTEL_EXPORTER_OTLP_ENDPOINT",
    "protocol_env": "CURVE_OTEL_EXPORTER_OTLP_PROTOCOL",
    "headers_env": "CURVE_OTEL_EXPORTER_OTLP_HEADERS",
    "insecure_env": "CURVE_OTEL_EXPORTER_OTLP_INSECURE",
    "certificate_env": "CURVE_OTEL_EXPORTER_OTLP_CERTIFICATE",
    "client_certificate_env": "CURVE_OTEL_EXPORTER_OTLP_CLIENT_CERTIFICATE",
    "client_key_env": "CURVE_OTEL_EXPORTER_OTLP_CLIENT_KEY",
    "workspace_scope_key_env": "CURVE_TELEMETRY_SCOPE_HMAC_KEY",
    "workspace_scope_key_id_env": "CURVE_TELEMETRY_SCOPE_KEY_ID",
    "allowed_protocols": ["grpc", "http/protobuf"],
    "endpoint_schemes": ["http", "https"],
    "endpoint_userinfo_allowed": false,
    "endpoint_query_allowed": false,
    "endpoint_fragment_allowed": false,
    "grpc_endpoint_path_mode": "ROOT_ONLY",
    "http_signal_path_mode": "APPEND_STANDARD_PATHS",
    "headers_format": "URL_ENCODED_COMMA_SEPARATED_KEY_VALUE",
    "insecure_boolean_values": ["true", "false"],
    "tls_file_path_mode": "ABSOLUTE_READ_ONLY",
    "tls_client_pair_mode": "BOTH_OR_NEITHER",
    "tls_maximum_file_bytes": 1048576,
    "system_trust_store_allowed": true,
    "compression": "NONE",
    "workspace_scope_key_input_encoding": "BASE64URL_NO_PADDING",
    "workspace_scope_key_id_pattern": "^[A-Za-z0-9][A-Za-z0-9._:-]{0,63}$",
    "explicit_endpoint_required": true,
    "external_default_endpoint_allowed": false,
    "insecure_allowed_environment": "LOCAL"
  },
  "export": {
    "otlp_signals": ["TRACES", "METRICS"],
    "structured_log_delivery": "STDOUT_JSON",
    "otlp_log_export_allowed": false,
    "local_only_metrics": ["curve.telemetry.export.failure"],
    "remote_path_failure_detection": "OBS_BIND_001_PLATFORM_SIGNAL",
    "exporter_timeout_millis": 10000,
    "span_batch": {
      "max_queue_size": 2048,
      "schedule_delay_millis": 5000,
      "max_export_batch_size": 512,
      "export_timeout_millis": 10000
    },
    "metric_reader": {
      "export_interval_millis": 60000,
      "export_timeout_millis": 10000
    },
    "shutdown_timeout_millis": 10000
  },
  "collection": {
    "gauge_implementation": "OBSERVABLE_GAUGE",
    "database_query_timeout_millis": 1000,
    "callback_failure_behavior": "OMIT_OBSERVATION_AND_LOG_BOUNDED",
    "heartbeat_update_interval_millis": 500,
    "heartbeat_absence_alert_required": true
  },
  "propagation": {
    "inbound_headers": ["traceparent"],
    "outbound_headers": ["traceparent"],
    "temporal_header": "_curve_traceparent_v1",
    "tracestate_allowed": false,
    "baggage_allowed": false,
    "invalid_traceparent_behavior": "START_NEW_TRACE"
  },
  "workspace_scope": {
    "minimum_key_bytes": 32,
    "maximum_key_bytes": 64,
    "digest_encoding": "BASE64URL_NO_PADDING",
    "rotation_behavior": "RESTART_WITH_NEW_KEY_ID",
    "raw_workspace_id_export_allowed": false
  },
  "instrumentation": {
    "scope": "CURVE_ONLY_MANUAL",
    "global_django_instrumentation_allowed": false,
    "global_provider_registration_allowed": false,
    "generic_otel_configuration_override_allowed": false,
    "otel_sdk_disabled_fail_closed": true,
    "api_initialization": "LAZY_PROCESS_LOCAL",
    "worker_initialization": "EXPLICIT_BEFORE_TEMPORAL_CONNECT",
    "workflow_exporter_io_allowed": false,
    "resource_construction": "STATIC_CURVE_RESOURCE_ONLY",
    "resource_attributes_by_component": {
      "API": {
        "service.name": "curve-api",
        "service.namespace": "curve",
        "deployment.environment.name": "local"
      },
      "TEMPORAL_WORKER": {
        "service.name": "curve-temporal-worker",
        "service.namespace": "curve",
        "deployment.environment.name": "local"
      }
    },
    "sampler": "PARENT_BASED_ALWAYS_ON",
    "shutdown_on_exit": false,
    "span_limits": {
      "max_attributes": 16,
      "max_span_attributes": 16,
      "max_events": 0,
      "max_event_attributes": 0,
      "max_links": 0,
      "max_link_attributes": 0,
      "max_attribute_length": 128,
      "max_span_attribute_length": 128
    },
    "automatic_exception_recording_allowed": false,
    "metric_exemplar_filter": "ALWAYS_OFF",
    "metric_temporality": "CUMULATIVE",
    "metric_default_view": "DROP_UNDECLARED",
    "histogram_boundaries_source": "MANIFEST_EXPLICIT_VIEW",
    "bootstrap_components": ["API", "TEMPORAL_WORKER"]
  },
  "correlation": {
    "application_field": "correlation_id",
    "trace_headers": ["traceparent"],
    "workspace_scope_algorithm": "HMAC-SHA256",
    "workspace_scope_domain": "curve-workspace-scope:v1",
    "metric_identifiers_allowed": false,
    "audit_bridge_fields": ["workspace_id", "correlation_id", "target_ref", "policy_decision_ref"]
  },
  "attribute_policy": {
    "trace_allowlist": [
      "curve.activity.type",
      "curve.cancel.requested",
      "curve.command.type",
      "curve.component",
      "curve.error.code",
      "curve.event.id",
      "curve.operation.id",
      "curve.operation.status",
      "curve.operation.type",
      "curve.outbox.destination_kind",
      "curve.outbox.state",
      "curve.replayed",
      "curve.result",
      "curve.retry.attempt",
      "curve.telemetry.scope_key_id",
      "curve.workflow.type",
      "curve.workspace.scope"
    ],
    "log_allowlist": [
      "curve.activity.type",
      "curve.command.type",
      "curve.component",
      "curve.error.code",
      "curve.event.code",
      "curve.event.id",
      "curve.operation.id",
      "curve.operation.status",
      "curve.operation.type",
      "curve.outbox.destination_kind",
      "curve.outbox.state",
      "curve.replayed",
      "curve.result",
      "curve.retry.attempt",
      "curve.telemetry.scope_key_id",
      "curve.workflow.type",
      "curve.workspace.scope",
      "log.level",
      "span.id",
      "trace.id"
    ],
    "forbidden_name_patterns": [
      "(authorization|cookie|credential|evidence|idempotency_key|password|patch|prompt|request_body|response_body|secret|source_code|token|tool_output)"
    ],
    "forbidden_value_classes": [
      "CREDENTIAL",
      "EVIDENCE_BODY",
      "MODEL_INPUT",
      "MODEL_OUTPUT",
      "PATCH_OR_SOURCE",
      "PROTECTED_OBJECT_BODY",
      "RAW_IDEMPOTENCY_KEY",
      "REQUEST_OR_RESPONSE_BODY",
      "TOOL_OUTPUT"
    ],
    "free_form_runtime_strings_allowed": false,
    "maximum_string_value_bytes": 128,
    "maximum_collection_items": 16
  },
  "metric_attributes": [
    {
      "name": "curve.activity.type",
      "allowed_values": ["MARK_OPERATION_CANCELLED", "MARK_OPERATION_RUNNING", "MARK_OPERATION_SUCCEEDED"]
    },
    {
      "name": "curve.component",
      "allowed_values": ["API", "AUDIT", "OUTBOX_RELAY", "SSE", "TELEMETRY", "TEMPORAL_WORKER"]
    },
    {
      "name": "curve.error.code",
      "allowed_values": [
        "CURVE_AUDIT_APPEND_FAILED",
        "CURVE_INVALID_COMMAND",
        "CURVE_INVALID_OPERATION_TRANSITION",
        "CURVE_OPTIMISTIC_CONCURRENCY",
        "CURVE_POLICY_DENIED",
        "CURVE_TELEMETRY_EXPORT_FAILED",
        "CURVE_TEMPORAL_UNAVAILABLE",
        "NONE"
      ]
    },
    {
      "name": "curve.operation.status",
      "allowed_values": [
        "CANCELLED",
        "CANCEL_REQUESTED",
        "FAILED",
        "PENDING",
        "QUEUED",
        "RUNNING",
        "SUCCEEDED",
        "WAITING_FOR_HUMAN"
      ]
    },
    {
      "name": "curve.operation.type",
      "allowed_values": ["FOUNDATION_PROBE"]
    },
    {
      "name": "curve.outbox.destination_kind",
      "allowed_values": ["CURVE_LOCAL", "TEMPORAL"]
    },
    {
      "name": "curve.outbox.state",
      "allowed_values": ["CLAIMED", "DEAD_LETTER", "DELIVERED", "PENDING", "RETRY_SCHEDULED"]
    },
    {
      "name": "curve.result",
      "allowed_values": ["CANCELLED", "DENIED", "FAILED", "REPLAYED", "RETRIED", "SUCCEEDED"]
    },
    {
      "name": "curve.workflow.type",
      "allowed_values": ["FOUNDATION_PROBE_V1"]
    }
  ],
  "metrics": [
    {
      "name": "curve.operation.started",
      "instrument": "COUNTER",
      "unit": "1",
      "description": "Accepted non-replayed Curve operations.",
      "allowed_attributes": ["curve.component", "curve.operation.type"]
    },
    {
      "name": "curve.operation.completed",
      "instrument": "COUNTER",
      "unit": "1",
      "description": "Curve operations reaching an allowed terminal result.",
      "allowed_attributes": ["curve.component", "curve.operation.type", "curve.result"]
    },
    {
      "name": "curve.operation.duration",
      "instrument": "HISTOGRAM",
      "unit": "s",
      "description": "Elapsed time from accepted operation creation to terminal state.",
      "allowed_attributes": ["curve.component", "curve.operation.type", "curve.result"],
      "boundaries": [0.1, 0.25, 0.5, 1, 2.5, 5, 10, 30, 60, 120, 300]
    },
    {
      "name": "curve.outbox.delivery",
      "instrument": "COUNTER",
      "unit": "1",
      "description": "Outbox delivery attempts and terminal outcomes.",
      "allowed_attributes": ["curve.component", "curve.outbox.destination_kind", "curve.result"]
    },
    {
      "name": "curve.outbox.backlog",
      "instrument": "GAUGE",
      "unit": "1",
      "description": "Current outbox rows by bounded lifecycle state.",
      "allowed_attributes": ["curve.component", "curve.outbox.state"]
    },
    {
      "name": "curve.outbox.oldest_age",
      "instrument": "GAUGE",
      "unit": "s",
      "description": "Age of the oldest deliverable outbox row.",
      "allowed_attributes": ["curve.component"]
    },
    {
      "name": "curve.workflow.completed",
      "instrument": "COUNTER",
      "unit": "1",
      "description": "Temporal workflow terminal outcomes.",